{
  "schema_version": "1.0",
  "task_id": "DEMO-001",
  "agent": "codex-database",
  "status": "PARTIAL",
  "summary": "",
  "files_changed": [],
  "contracts_used": [
    "contracts/openapi.yaml"
  ],
  "tests": {
    "passed": false,
    "commands": [],
    "notes": ""
  },
  "blockers": [],
  "notes_for_next_agent": [],
  "database_changes": {
    "provider": "",
    "environment": "development",
    "mcp_used": false,
    "migration_files": [],
    "applied_migrations": [],
    "rls_reviewed": false,
    "indexes_reviewed": false,
    "advisors_checked": false,
    "live_verification": "NOT_RUN"
  }
}
