{
  "schema_version": "1.0",
  "task_id": "FOUNDATION-001",
  "agent": "codex-tester",
  "status": "PARTIAL",
  "summary": "",
  "files_changed": [],
  "contracts_used": [
    "contracts/openapi.yaml"
  ],
  "tests": {
    "passed": false,
    "commands": [],
    "notes": ""
  },
  "blockers": [],
  "notes_for_next_agent": []
}
