{
  "schema_version": "1.0",
  "task_id": "FRONTEND-001",
  "agent": "gemini-frontend",
  "status": "COMPLETE",
  "summary": "Synchronized package-lock.json, removed unused user-event dependency drift, removed parent-directory Vite access, prevented credentialed-backend reuse with isolated FastAPI server instances, removed LD_LIBRARY_PATH config mutations, and implemented complete model-metadata validation.",
  "files_changed": [
    "frontend/README.md",
    "frontend/package.json",
    "frontend/package-lock.json",
    "frontend/vitest.config.ts",
    "frontend/playwright.config.ts",
    "frontend/src/index.css",
    "frontend/src/api/adapter.ts",
    "frontend/src/api/adapter.test.ts",
    "frontend/e2e/dashboard.spec.ts",
    "frontend/e2e/real-proxy-smoke.spec.ts",
    ".ai/tasks/FRONTEND-001/frontend-report.json"
  ],
  "contracts_used": [
    "contracts/openapi.yaml"
  ],
  "tests": {
    "passed": true,
    "commands": [
      "npm run check:api",
      "npm run lint",
      "npm run typecheck",
      "npm run test:unit",
      "npm run build",
      "npm run test:e2e",
      "npm audit --audit-level=high",
      "npm run verify"
    ],
    "notes": "Synchronized package-lock.json with 0 audit vulnerabilities; 27 Vitest unit/integration tests pass in frontend scope; 12 Playwright E2E browser tests pass (including unshared credential-free FastAPI proxy smoke, axe accessibility scans, reduced motion emulation, and responsive viewport checks); 51 backend tests and 12 agentic tests pass."
  },
  "blockers": [],
  "notes_for_next_agent": [
    "Lockfile and dependencies are cleanly synchronized without unused drift.",
    "Parent-directory Vite filesystem access and LD_LIBRARY_PATH config mutations have been removed.",
    "FastAPI backend process in Playwright is isolated (reuseExistingServer: false) to guarantee credential-free validation.",
    "Model metadata schema validation is fully verified.",
    "Ready for feature verification and GitHub PR publication."
  ]
}
